{
  "version": 2,
  "host": {
    "name": "forja",
    "address": "10.62.91.2",
    "runtime": "docker-compose"
  },
  "browser": {
    "image": "selenium/standalone-chrome@sha256:9569014786466376d3e5cf8a7758562368cd9637f783dcd3abdb2eaf3a0d5cd7",
    "webdriver_bind": "127.0.0.1:14444",
    "novnc_bind": "10.62.91.2:17900",
    "max_sessions": 1,
    "screen": {
      "width": 1440,
      "height": 900,
      "depth": 24
    }
  },
  "network": {
    "viewer_sources": [
      "10.0.0.0/16"
    ],
    "proxy_sources": [
      "10.62.91.3/32"
    ],
    "public_exposure": false,
    "direct_link": "http://10.62.91.2:17900/",
    "fixed_link": "https://cloudiff.duckdns.org/__cloudiff_webdev/",
    "fixed_link_access": "vpn-only-10.0.0.0/16"
  },
  "resources": {
    "cpus": 1.0,
    "memory_bytes": 2147483648,
    "shm_bytes": 1073741824
  },
  "workspace": {
    "host_path": "/srv/cloudif/webdev-workspace",
    "container_path": "/workspace",
    "read_only": true
  },
  "security": {
    "docker_socket": false,
    "privileged": false,
    "additional_agent": false,
    "novnc_password": "disabled-vpn-only",
    "no_new_privileges": true
  },
  "simulation": {
    "dns_server": "10.68.128.252",
    "physical_ad_host": "10.68.128.252",
    "allowed_readonly_services": [
      "dns",
      "ldap",
      "ldaps",
      "global-catalog"
    ]
  }
}
